{
  "schema_version": 1,
  "state": "designed",
  "profile": [],
  "history": [
    {
      "from": null,
      "to": "proposed",
      "at": "2026-05-11T07:01:05.384Z",
      "by": "pkcs12",
      "mode": "new",
      "reason": "initial spec created via plan-init.ts"
    },
    {
      "from": "proposed",
      "to": "designed",
      "at": "2026-05-11T07:04:48.919Z",
      "by": "pkcs12",
      "mode": "promote",
      "reason": "framework artifacts authored (proposal + spec + design + idef0 root + grafcet + c4 + sequence + data-schema); ready to commence chapter-batch authoring"
    }
  ]
}
