{
  "schema_version": 1,
  "state": "living",
  "profile": [],
  "history": [
    {
      "from": null,
      "to": "proposed",
      "at": "2026-04-23T17:54:04.653Z",
      "by": "pkcs12",
      "mode": "new",
      "reason": "initial spec created via plan-init.ts"
    },
    {
      "from": "proposed",
      "to": "designed",
      "at": "2026-04-23T18:00:34.193Z",
      "by": "pkcs12",
      "mode": "promote",
      "reason": "spec + design + idef0/grafcet/c4/sequence + data-schema drafted; 6 Requirements, 10 DDs, removal inventory"
    },
    {
      "from": "designed",
      "to": "planned",
      "at": "2026-04-23T18:06:25.960Z",
      "by": "pkcs12",
      "mode": "promote",
      "reason": "tasks (9 phases, ~45 items) + handoff + errors + observability + test-vectors drafted"
    },
    {
      "from": "planned",
      "to": "implementing",
      "at": "2026-04-23T19:45:17.301Z",
      "by": "pkcs12",
      "mode": "promote",
      "reason": "implementation started on beta branch"
    },
    {
      "from": "implementing",
      "to": "verified",
      "at": "2026-04-23T19:45:17.797Z",
      "by": "pkcs12",
      "mode": "promote",
      "reason": "all 10 phases implemented + mobile smoke passed + merged to main c7f0ddb8b"
    },
    {
      "from": "verified",
      "to": "living",
      "at": "2026-04-23T19:45:18.295Z",
      "by": "pkcs12",
      "mode": "promote",
      "reason": "merged to main c7f0ddb8b; -550 LOC net continuity removal; mobile stable"
    }
  ]
}
