{
  "schema_version": 1,
  "state": "planned",
  "profile": [],
  "history": [
    {
      "from": null,
      "to": "proposed",
      "at": "2026-05-05T04:37:48.168Z",
      "by": "pkcs12",
      "mode": "new",
      "reason": "initial spec created via plan-init.ts"
    },
    {
      "from": "proposed",
      "to": "designed",
      "at": "2026-05-05T04:49:40.111Z",
      "by": "pkcs12",
      "mode": "promote",
      "reason": "all designed-state artifacts authored and validated"
    },
    {
      "from": "designed",
      "to": "planned",
      "at": "2026-05-05T04:52:12.324Z",
      "by": "pkcs12",
      "mode": "promote",
      "reason": "tasks.md / handoff.md / test-vectors.json / errors.md / observability.md authored"
    }
  ]
}
