{
  "schema_version": 1,
  "state": "planned",
  "profile": [],
  "history": [
    {
      "from": null,
      "to": "planned",
      "at": "2026-05-12T00:24:20.004Z",
      "by": "pkcs12",
      "mode": "migration",
      "reason": "peaceful on-touch migration from plans/subagent-taxonomy/",
      "snapshot": ".archive/pre-migration-20260512"
    }
  ]
}
