{
  "schema_version": 1,
  "state": "archived",
  "profile": [],
  "history": [
    {
      "from": null,
      "to": "proposed",
      "at": "2026-04-18T21:44:51.738Z",
      "by": "pkcs12",
      "mode": "new",
      "reason": "initial spec created via plan-init.ts"
    },
    {
      "from": "proposed",
      "to": "designed",
      "at": "2026-04-18T21:55:31.094Z",
      "by": "pkcs12",
      "mode": "promote",
      "reason": "spec/design/idef0/grafcet/c4/sequence/data-schema drafted 2026-04-19"
    },
    {
      "from": "designed",
      "to": "planned",
      "at": "2026-04-18T22:08:27.157Z",
      "by": "pkcs12",
      "mode": "promote",
      "reason": "tasks/handoff/test-vectors/errors/observability drafted 2026-04-19"
    },
    {
      "from": "planned",
      "to": "archived",
      "at": "2026-05-06T00:00:00.000Z",
      "by": "pkcs12",
      "mode": "archive",
      "reason": "superseded — autonomous design diverged substantially from this opt-in gate plan; preserved for reference. Original branch shelf/autonomous-opt-in (impl Phase 1+2 in commits 6db33208d, ed8e9be2e) deleted."
    }
  ]
}
