{
  "schema_version": 1,
  "state": "planned",
  "profile": [],
  "history": [
    {
      "from": null,
      "to": "proposed",
      "at": "2026-04-18T22:00:00Z",
      "by": "Raw1mage",
      "mode": "new",
      "reason": "initial spec created via plan-init.ts"
    },
    {
      "from": "proposed",
      "to": "proposed",
      "at": "2026-04-19T06:05:00Z",
      "by": "Raw1mage",
      "mode": "sync",
      "result": "warned",
      "drift": [
        "proposal.md + .state.json lost during branch switch to test/session-poll-cache; rebuilt"
      ],
      "reason": "rebuild after branch switch caused file loss"
    },
    {
      "from": "proposed",
      "to": "designed",
      "at": "2026-04-18T22:05:43.526Z",
      "by": "pkcs12",
      "mode": "promote",
      "reason": "A+B+C scope design artifacts drafted (spec/design/idef0/grafcet/c4/sequence/data-schema)"
    },
    {
      "from": "designed",
      "to": "planned",
      "at": "2026-04-18T22:08:27.649Z",
      "by": "pkcs12",
      "mode": "promote",
      "reason": "tasks/handoff/test-vectors/errors/observability drafted; ready for build-mode"
    }
  ]
}
